{
  "schema_version": "makise.morphotype-definition.v1",
  "morphotype_id": "human-v1",
  "version": "0.1.0",
  "content_digest": "sha256:3333333333333333333333333333333333333333333333333333333333333333",
  "root_definition": true,
  "anatomy_graph": {
    "nodes": [
      { "node_id": "body", "kind": "mammalian-body", "count": 1 },
      { "node_id": "external-auricles", "kind": "human-auricle-pair", "count": 1 },
      { "node_id": "circulation", "kind": "closed-circulatory-system", "count": 1 },
      { "node_id": "thigh-left", "kind": "human-thigh-segment", "count": 1 },
      { "node_id": "shank-left", "kind": "human-shank-segment", "count": 1 },
      { "node_id": "thigh-right", "kind": "human-thigh-segment", "count": 1 },
      { "node_id": "shank-right", "kind": "human-shank-segment", "count": 1 }
    ],
    "edges": [
      { "from": "external-auricles", "to": "body", "relation": "anatomical-part-of" },
      { "from": "circulation", "to": "body", "relation": "anatomical-part-of" },
      {
        "from": "thigh-left", "to": "body", "relation": "articulated-joint-of",
        "joint": { "limit_min_urad": -300000, "limit_max_urad": 2000000, "driven_inertia_mgm2": 1000000 }
      },
      {
        "from": "shank-left", "to": "thigh-left", "relation": "articulated-joint-of",
        "joint": { "limit_min_urad": 0, "limit_max_urad": 2400000, "driven_inertia_mgm2": 400000 }
      },
      {
        "from": "thigh-right", "to": "body", "relation": "articulated-joint-of",
        "joint": { "limit_min_urad": -300000, "limit_max_urad": 2000000, "driven_inertia_mgm2": 1000000 }
      },
      {
        "from": "shank-right", "to": "thigh-right", "relation": "articulated-joint-of",
        "joint": { "limit_min_urad": 0, "limit_max_urad": 2400000, "driven_inertia_mgm2": 400000 }
      }
    ]
  },
  "development": {
    "program_id": "human-development-v1",
    "artifact_digest": "sha256:4444444444444444444444444444444444444444444444444444444444444444",
    "validity_range": "Schema-only placeholder; development kinetics are not implemented in Phase 0"
  },
  "organ_bindings": [
    {
      "anatomy_node_id": "circulation",
      "mechanism_id": "mammalian.oxygen-transport",
      "mechanism_digest": "sha256:1111111111111111111111111111111111111111111111111111111111111111",
      "resolution_id": "cell-cohort-v1"
    }
  ],
  "physiological_parameters": [
    {
      "parameter_id": "reference-core-temperature",
      "value": 310.15,
      "unit": "K",
      "provenance_category": "expert_estimate",
      "uncertainty": 1.0,
      "validity_range": "Adult resting schema fixture only"
    },
    {
      "parameter_id": "awake-metabolism-uj-per-s",
      "value": 95000000,
      "unit": "uj_per_s",
      "provenance_category": "expert_estimate",
      "uncertainty": 5000000,
      "validity_range": "Human baseline 95 W awake, docs/research/biology-realism.md"
    },
    {
      "parameter_id": "asleep-metabolism-uj-per-s",
      "value": 75000000,
      "unit": "uj_per_s",
      "provenance_category": "expert_estimate",
      "uncertainty": 5000000,
      "validity_range": "Human baseline 75 W asleep"
    },
    {
      "parameter_id": "night-awake-metabolism-uj-per-s",
      "value": 88000000,
      "unit": "uj_per_s",
      "provenance_category": "expert_estimate",
      "uncertainty": 5000000,
      "validity_range": "Human night awake 88 W"
    },
    {
      "parameter_id": "core-heat-capacity-uj-per-mk",
      "value": 216380000,
      "unit": "uj_per_mk",
      "provenance_category": "expert_estimate",
      "uncertainty": 10000000,
      "validity_range": "3490 J/kgK * 62 kg"
    },
    {
      "parameter_id": "ambient-conductance-uj-per-mk-s",
      "value": 5600,
      "unit": "uj_per_mk_s",
      "provenance_category": "expert_estimate",
      "uncertainty": 1000,
      "validity_range": "Whole-body passive 4-10 W/K band"
    }
  ],
  "phenotypes": [
    {
      "phenotype_id": "female-makise-v1",
      "sex": "female",
      "parameter_overrides": [
        {
          "parameter_id": "initial-body-mass",
          "value": 55.0,
          "unit": "kg",
          "provenance_category": "expert_estimate",
          "uncertainty": 5.0,
          "validity_range": "Initial adult phenotype fixture, not a population reference"
        }
      ]
    }
  ],
  "shared_mechanism_refs": [
    "sha256:1111111111111111111111111111111111111111111111111111111111111111"
  ],
  "validation_fixtures": [
    { "fixture_id": "human-root-isolation", "evidence_kind": "schema_only", "acceptance": "Definition is a root and contains no inheritance field" },
    { "fixture_id": "locomotor-joint-limits", "evidence_kind": "expert_estimate", "acceptance": "Hip range approx -17..115 degrees, knee 0..137.5 degrees; segment inertias are coarse adult estimates, uncalibrated" }
  ]
}
